{"entries":[{"basename":"JS26032501-1-03-036#上下座B#A1.pdf","opaque_ref":"external-input://sha256/58b9cf08ad90ad4ef647661165e989cd45984dbeaa9c0f63042a69eccc017bec","order":1,"page_metadata":{"page_count":2,"physical_page":"A3 landscape"},"sha256":"58b9cf08ad90ad4ef647661165e989cd45984dbeaa9c0f63042a69eccc017bec"},{"basename":"JS20102801-02-018#手指头#A1.pdf","opaque_ref":"external-input://sha256/ffee22f2e392f309d3d0acfc2edadc4a8d5330a9bc28009263af5d8597074a86","order":2,"page_metadata":{"page_count":1,"physical_page":"A4 portrait"},"sha256":"ffee22f2e392f309d3d0acfc2edadc4a8d5330a9bc28009263af5d8597074a86"},{"basename":"JS20123103-10-033#手臂拖链支架上改#A2.pdf","opaque_ref":"external-input://sha256/322d56b00456f495830386b8dc50a32e34086a5bc66d4735e2c3c735d5fbc57d","order":3,"page_metadata":{"page_count":1,"physical_page":"A4 portrait"},"sha256":"322d56b00456f495830386b8dc50a32e34086a5bc66d4735e2c3c735d5fbc57d"},{"basename":"JS24030402-30-013#上插臂#A0.pdf","opaque_ref":"external-input://sha256/8fffd93fa7f055f9fe1a7da25bc85630910bdfc2ea86b2ace6ec54979f0a515e","order":4,"page_metadata":{"page_count":2,"physical_page":"A3 landscape"},"sha256":"8fffd93fa7f055f9fe1a7da25bc85630910bdfc2ea86b2ace6ec54979f0a515e"}],"first_checkpoint":{"basename":"JS26032501-1-03-036#上下座B#A1.pdf","opaque_ref":"external-input://sha256/58b9cf08ad90ad4ef647661165e989cd45984dbeaa9c0f63042a69eccc017bec","order":1,"sha256":"58b9cf08ad90ad4ef647661165e989cd45984dbeaa9c0f63042a69eccc017bec"},"input_set":"current-four","schema_version":"current-four-manifest/1"}